{"$id":"https://single-image-studio.invalid/research/slice-11/schemas/source-lineage.slice11.v0.schema.json","$schema":"https://json-schema.org/draft/2020-12/schema","additionalProperties":false,"properties":{"captureSessionId":{"pattern":"^[A-Za-z0-9][A-Za-z0-9._:@/-]{2,199}$","type":"string"},"categoryId":{"pattern":"^[A-Za-z0-9][A-Za-z0-9._:@/-]{2,199}$","type":"string"},"contentHash":{"pattern":"^[a-f0-9]{64}$","type":"string"},"copiedImageBytes":{"const":false},"disposition":{"enum":["applicable","rejection"]},"evidenceBoundary":{"additionalProperties":false,"properties":{"c1":{"const":0},"e1":{"const":0},"formalEvidence":{"const":false},"g1":{"const":0},"o1":{"const":0},"productSupport":{"const":false},"r1Pipeline":{"const":0},"r1ProductRelease":{"const":0},"r1ProductValidation":{"const":0},"releaseAllowlist":{"const":"none"},"releaseApproved":{"const":0},"releaseRegistered":{"const":0},"u1":{"const":0},"v1":{"const":0}},"required":["c1","e1","formalEvidence","g1","o1","productSupport","r1Pipeline","r1ProductRelease","r1ProductValidation","releaseAllowlist","releaseApproved","releaseRegistered","u1","v1"],"type":"object"},"expectedStableErrorCode":{"oneOf":[{"type":"null"},{"maxLength":200000,"minLength":1,"type":"string"}]},"frozenAt":{"format":"date-time","type":"string"},"id":{"pattern":"^[A-Za-z0-9][A-Za-z0-9._:@/-]{2,199}$","type":"string"},"independenceClaim":{"const":false},"operation":{"enum":["normalize","export"]},"partition":{"enum":["dev/calibration","defect/calibration"]},"priorSlice10GoldIdentityRef":{"oneOf":[{"type":"null"},{"additionalProperties":false,"properties":{"byteLength":{"minimum":1,"type":"integer"},"contentHash":{"pattern":"^[a-f0-9]{64}$","type":"string"},"fileSha256":{"pattern":"^[a-f0-9]{64}$","type":"string"},"id":{"pattern":"^[A-Za-z0-9][A-Za-z0-9._:@/-]{2,199}$","type":"string"},"path":{"maxLength":200000,"minLength":1,"type":"string"}},"required":["path","id","contentHash","byteLength","fileSha256"],"type":"object"}]},"priorSlice10SourceRef":{"additionalProperties":false,"properties":{"byteLength":{"minimum":1,"type":"integer"},"contentHash":{"pattern":"^[a-f0-9]{64}$","type":"string"},"fileSha256":{"pattern":"^[a-f0-9]{64}$","type":"string"},"id":{"pattern":"^[A-Za-z0-9][A-Za-z0-9._:@/-]{2,199}$","type":"string"},"path":{"maxLength":200000,"minLength":1,"type":"string"}},"required":["path","id","contentHash","byteLength","fileSha256"],"type":"object"},"rawAsset":{"additionalProperties":false,"properties":{"byteLength":{"minimum":1,"type":"integer"},"decodedPixelSha256":{"oneOf":[{"type":"null"},{"pattern":"^[a-f0-9]{64}$","type":"string"}]},"fileSha256":{"pattern":"^[a-f0-9]{64}$","type":"string"},"mime":{"maxLength":200000,"minLength":1,"type":"string"},"path":{"maxLength":200000,"minLength":1,"type":"string"},"sourceDeclarationDecodedPixelSha256":{"oneOf":[{"type":"null"},{"pattern":"^[a-f0-9]{64}$","type":"string"}]}},"required":["path","mime","byteLength","fileSha256","decodedPixelSha256","sourceDeclarationDecodedPixelSha256"],"type":"object"},"schemaVersion":{"const":"source-lineage.slice11.v0"},"sourceFamilyId":{"pattern":"^[A-Za-z0-9][A-Za-z0-9._:@/-]{2,199}$","type":"string"}},"required":["schemaVersion","id","operation","partition","disposition","categoryId","expectedStableErrorCode","captureSessionId","sourceFamilyId","priorSlice10SourceRef","priorSlice10GoldIdentityRef","rawAsset","independenceClaim","copiedImageBytes","frozenAt","evidenceBoundary","contentHash"],"type":"object"}
