{"captureSessionId":"session.s11.normalize.defect.018","categoryId":"injected-resource-limit-or-unsupported-format-defect","contentHash":"05b100a6a65129d618af0b3c6132d62f5fe868119ff94f712f3b16a0008f6c8e","copiedImageBytes":false,"disposition":"rejection","evidenceBoundary":{"c1":0,"e1":0,"formalEvidence":false,"g1":0,"o1":0,"productSupport":false,"r1Pipeline":0,"r1ProductRelease":0,"r1ProductValidation":0,"releaseAllowlist":"none","releaseApproved":0,"releaseRegistered":0,"u1":0,"v1":0},"expectedStableErrorCode":"S11_NORMALIZE_SOURCE_DECLARATION_INVALID","frozenAt":"2026-08-15T23:01:50.529Z","id":"s11.normalize.defect.018","independenceClaim":false,"operation":"normalize","partition":"defect/calibration","priorSlice10GoldIdentityRef":null,"priorSlice10SourceRef":{"byteLength":1979,"contentHash":"d2fefac2ab5379780ad2e3ba0de828ff568bf2a2e2389530cc7e117e20e7fbb0","fileSha256":"2c32f113bb145934fd99887d39d439df3a9aec2de76d4dc07c6abddb8fdd0454","id":"s10.normalize.defect.018","path":"research/slice-10/source-lineage/normalize/defect-calibration/s10.normalize.defect.018.json"},"rawAsset":{"byteLength":1048577,"decodedPixelSha256":null,"fileSha256":"53142e6edddc02227154c69dae8b278253fe4dfd9675174a70f28c2cb2dcc616","mime":"image/png","path":"assets/open/normalize-defect/raw.s05.normalize.defect.018.png","sourceDeclarationDecodedPixelSha256":"afa04b7b14355129bfa71d84fe2d08457a063925051d01ebf084a6bd836516f9"},"schemaVersion":"source-lineage.slice11.v0","sourceFamilyId":"family.s11.normalize.defect.018"}
