{"captureSessionId":"session.s11.export.dev.012","categoryId":"valid-partial-alpha-normalized-artifact","contentHash":"b4200cd97af25913b660e95da1c011af40d26aebc4efa87dfc6aa5e77ad954dc","copiedImageBytes":false,"disposition":"applicable","evidenceBoundary":{"c1":0,"e1":0,"formalEvidence":false,"g1":0,"o1":0,"productSupport":false,"r1Pipeline":0,"r1ProductRelease":0,"r1ProductValidation":0,"releaseAllowlist":"none","releaseApproved":0,"releaseRegistered":0,"u1":0,"v1":0},"expectedStableErrorCode":null,"frozenAt":"2026-08-15T23:01:50.529Z","id":"s11.export.dev.012","independenceClaim":false,"operation":"export","partition":"dev/calibration","priorSlice10GoldIdentityRef":{"byteLength":2540,"contentHash":"5d90c7c2f4a1b28adf974fe24c0a82edefa79b3ed6055d0504e1d174ef52f03f","fileSha256":"5bbfa4d5cfe9dbffe430b6d0f06e05fab687441773246c4a97148a0941bae06b","id":"gold-identity.s10.export.dev.012","path":"research/slice-10/gold-identities/export/dev-calibration/gold-identity.s10.export.dev.012.json"},"priorSlice10SourceRef":{"byteLength":2453,"contentHash":"548e80d1c5fd21372dc9c3b2db1b48f119d602dc306b2343ac8862299c56960f","fileSha256":"30776185a0d54768b827bc9746ee0558042b642f89012d1d1dd8e4ba931a9d7b","id":"s10.export.dev.012","path":"research/slice-10/source-lineage/export/dev-calibration/s10.export.dev.012.json"},"rawAsset":{"byteLength":1662,"decodedPixelSha256":"5b476877cf06041dc9ab784b8c585fb4dec7814db84b0eae68c4c9bd3a6d0f93","fileSha256":"9b0f221d820bc4c8b93e607923ac421b14e3ed1b296dd11adb23c92aece1313f","mime":"image/png","path":"assets/open/export-dev/raw.s05.export.dev.012.png","sourceDeclarationDecodedPixelSha256":"5b476877cf06041dc9ab784b8c585fb4dec7814db84b0eae68c4c9bd3a6d0f93"},"schemaVersion":"source-lineage.slice11.v0","sourceFamilyId":"family.s11.export.dev.012"}
