{"captureSessionId":"session.s11.normalize.dev.004","categoryId":"canonical-opaque-source-png","contentHash":"303bf468e92bf6be3d433ea4eabc1aa79a8daa8a770292f4d8af57a0193afe45","copiedImageBytes":false,"disposition":"applicable","evidenceBoundary":{"c1":0,"e1":0,"formalEvidence":false,"g1":0,"o1":0,"productSupport":false,"r1Pipeline":0,"r1ProductRelease":0,"r1ProductValidation":0,"releaseAllowlist":"none","releaseApproved":0,"releaseRegistered":0,"u1":0,"v1":0},"expectedStableErrorCode":null,"frozenAt":"2026-08-15T23:01:50.529Z","id":"s11.normalize.dev.004","independenceClaim":false,"operation":"normalize","partition":"dev/calibration","priorSlice10GoldIdentityRef":{"byteLength":2175,"contentHash":"95acbb57289874629aace725144bbd93e5041270f002fff14958a946847fd953","fileSha256":"de9be64a680b60b6a05a9a1207c53abe6de97e65011b6f9ec274cc5ee788e043","id":"gold-identity.s10.normalize.dev.004","path":"research/slice-10/gold-identities/normalize/dev-calibration/gold-identity.s10.normalize.dev.004.json"},"priorSlice10SourceRef":{"byteLength":2154,"contentHash":"b0966d7ef46aea77c80e6f76c6217b619041d232ac72b554dbe1904ce754e61c","fileSha256":"c98ba475d87983bd75eb077da858ba377ee8652aaa318dfc83a8ca2a0e863dba","id":"s10.normalize.dev.004","path":"research/slice-10/source-lineage/normalize/dev-calibration/s10.normalize.dev.004.json"},"rawAsset":{"byteLength":954,"decodedPixelSha256":"cd1b1380c295fb373aebc038f0a1420e4aedfb480c26728e7c1093237346fcce","fileSha256":"43ad633ceb72a59ce16ffdeca047e63a251ebfa463eac0a6b1ed4720bad9c148","mime":"image/png","path":"assets/open/normalize-dev/raw.s05.normalize.dev.004.png","sourceDeclarationDecodedPixelSha256":"cd1b1380c295fb373aebc038f0a1420e4aedfb480c26728e7c1093237346fcce"},"schemaVersion":"source-lineage.slice11.v0","sourceFamilyId":"family.s11.normalize.dev.004"}
