{"captureSessionId":"session.s11.export.dev.020","categoryId":"normalized-artifact-shape-or-contract-invalid","contentHash":"27e3ab148732075d35bd7b9d4e078532c650ffb47e4f5cf989540a4464564aca","copiedImageBytes":false,"disposition":"rejection","evidenceBoundary":{"c1":0,"e1":0,"formalEvidence":false,"g1":0,"o1":0,"productSupport":false,"r1Pipeline":0,"r1ProductRelease":0,"r1ProductValidation":0,"releaseAllowlist":"none","releaseApproved":0,"releaseRegistered":0,"u1":0,"v1":0},"expectedStableErrorCode":"S11_EXPORT_NORMALIZED_ARTIFACT_INVALID","frozenAt":"2026-08-15T23:01:50.529Z","id":"s11.export.dev.020","independenceClaim":false,"operation":"export","partition":"dev/calibration","priorSlice10GoldIdentityRef":null,"priorSlice10SourceRef":{"byteLength":2290,"contentHash":"957fe478685a40e254c2d088178b34a5bf8c9583faa3eea6c33c7a12371664eb","fileSha256":"1a19a071aa8b6e3e6fcfbbcdd2431b2618210eb698e80ca4380f92886ac4d0fc","id":"s10.export.dev.020","path":"research/slice-10/source-lineage/export/dev-calibration/s10.export.dev.020.json"},"rawAsset":{"byteLength":765,"decodedPixelSha256":"2e0ae59bedc46ee1bd564a199556c5a0584bd99620efe5105dbc52556cfe4493","fileSha256":"4c3ace817644c4ad474fef581e0b1326c4c8046d01483349cb9883ca85eeefc1","mime":"image/png","path":"assets/open/export-dev/raw.s05.export.dev.020.png","sourceDeclarationDecodedPixelSha256":"2e0ae59bedc46ee1bd564a199556c5a0584bd99620efe5105dbc52556cfe4493"},"schemaVersion":"source-lineage.slice11.v0","sourceFamilyId":"family.s11.export.dev.020"}
