{"captureSessionId":"session.s11.normalize.dev.013","categoryId":"canonical-alpha-holes-source-png","contentHash":"3d44c9c2205c33754b87d15bf0c11d9bb544f97ceb8164ff51d28e2ecd8157d6","copiedImageBytes":false,"disposition":"applicable","evidenceBoundary":{"c1":0,"e1":0,"formalEvidence":false,"g1":0,"o1":0,"productSupport":false,"r1Pipeline":0,"r1ProductRelease":0,"r1ProductValidation":0,"releaseAllowlist":"none","releaseApproved":0,"releaseRegistered":0,"u1":0,"v1":0},"expectedStableErrorCode":null,"frozenAt":"2026-08-15T23:01:50.529Z","id":"s11.normalize.dev.013","independenceClaim":false,"operation":"normalize","partition":"dev/calibration","priorSlice10GoldIdentityRef":{"byteLength":2173,"contentHash":"5db0ecf2842dfef99e371beba9c970b353b3b93965cbcd401503886ad4c405f2","fileSha256":"d00eee6f80f3931fca3429348067ffa9bcc89300cb7e4bb335c58747c69b49f7","id":"gold-identity.s10.normalize.dev.013","path":"research/slice-10/gold-identities/normalize/dev-calibration/gold-identity.s10.normalize.dev.013.json"},"priorSlice10SourceRef":{"byteLength":2159,"contentHash":"304b94248c002d1fe20fa2af70519b8a971dbec9035b9aa5b244767410aae1e3","fileSha256":"66c4fece9665dd34dd16e1dfc2ba20e94f281a33f90055151846ea348df8cbc5","id":"s10.normalize.dev.013","path":"research/slice-10/source-lineage/normalize/dev-calibration/s10.normalize.dev.013.json"},"rawAsset":{"byteLength":754,"decodedPixelSha256":"42cc0340c0b9d16dfc95e19d2530a459eaf9429d7492552690fe3914c651de89","fileSha256":"2b41d6987368f13ac93dce6378664fb47691b67cdb82ec2928f40228cceddac7","mime":"image/png","path":"assets/open/normalize-dev/raw.s05.normalize.dev.013.png","sourceDeclarationDecodedPixelSha256":"42cc0340c0b9d16dfc95e19d2530a459eaf9429d7492552690fe3914c651de89"},"schemaVersion":"source-lineage.slice11.v0","sourceFamilyId":"family.s11.normalize.dev.013"}
