{"captureSessionId":"session.s11.normalize.dev.017","categoryId":"canonical-alpha-holes-source-png","contentHash":"8ef4bdbb8b89e6548f03c5d917b9e875960fa92f4c61034f8598a48f2e44be09","copiedImageBytes":false,"disposition":"applicable","evidenceBoundary":{"c1":0,"e1":0,"formalEvidence":false,"g1":0,"o1":0,"productSupport":false,"r1Pipeline":0,"r1ProductRelease":0,"r1ProductValidation":0,"releaseAllowlist":"none","releaseApproved":0,"releaseRegistered":0,"u1":0,"v1":0},"expectedStableErrorCode":null,"frozenAt":"2026-08-15T23:01:50.529Z","id":"s11.normalize.dev.017","independenceClaim":false,"operation":"normalize","partition":"dev/calibration","priorSlice10GoldIdentityRef":{"byteLength":2174,"contentHash":"c7c964881accaa03782feaec9ec631bcaa0029abb89c70ca0e5f351253fc7dc8","fileSha256":"ab8f4c5c4f91050c313d899afeb829bdd6bb6eb8da75108f4ad4f72e2592d191","id":"gold-identity.s10.normalize.dev.017","path":"research/slice-10/gold-identities/normalize/dev-calibration/gold-identity.s10.normalize.dev.017.json"},"priorSlice10SourceRef":{"byteLength":2160,"contentHash":"34ab0b35047b521808744d9e232e230db540dec18e2015165a6bc5cc3584fb99","fileSha256":"e88ef7f7fe7248c3b50af4be1b03ece3d2039831dc159c65d43cadefb329d659","id":"s10.normalize.dev.017","path":"research/slice-10/source-lineage/normalize/dev-calibration/s10.normalize.dev.017.json"},"rawAsset":{"byteLength":1260,"decodedPixelSha256":"8558bc9de16c79a3e7a583400f072d4cadd6679c2271223213ef65769f60773d","fileSha256":"9852d366c4ae5af30deb3e80e988f67e361fe57204f64982a427fcdcf7434f29","mime":"image/png","path":"assets/open/normalize-dev/raw.s05.normalize.dev.017.png","sourceDeclarationDecodedPixelSha256":"8558bc9de16c79a3e7a583400f072d4cadd6679c2271223213ef65769f60773d"},"schemaVersion":"source-lineage.slice11.v0","sourceFamilyId":"family.s11.normalize.dev.017"}
