{"captureSessionId":"session.s11.normalize.dev.015","categoryId":"canonical-alpha-holes-source-png","contentHash":"39bf0c4a13a16e7d4891c1168fab707ee0d5431d06cb75ba100874c98510a5ce","copiedImageBytes":false,"disposition":"applicable","evidenceBoundary":{"c1":0,"e1":0,"formalEvidence":false,"g1":0,"o1":0,"productSupport":false,"r1Pipeline":0,"r1ProductRelease":0,"r1ProductValidation":0,"releaseAllowlist":"none","releaseApproved":0,"releaseRegistered":0,"u1":0,"v1":0},"expectedStableErrorCode":null,"frozenAt":"2026-08-15T23:01:50.529Z","id":"s11.normalize.dev.015","independenceClaim":false,"operation":"normalize","partition":"dev/calibration","priorSlice10GoldIdentityRef":{"byteLength":2174,"contentHash":"736c59c71bf10355a3ec07a541a7d2330d8416e3a84d4f52abf61acd64ab8b4e","fileSha256":"25a42e4f6a4a62713734110a29d98d7c71a533e8f2b32edfdc1bd86ac62ec59e","id":"gold-identity.s10.normalize.dev.015","path":"research/slice-10/gold-identities/normalize/dev-calibration/gold-identity.s10.normalize.dev.015.json"},"priorSlice10SourceRef":{"byteLength":2159,"contentHash":"c3d6bd48cdcbe0189d12b3bd9dd1e636d4bca5a5d1b0c563f9a343fd85cc9a2d","fileSha256":"bd050bf2c7eecef9eb2317eb73394082ac8701c264fdd3d1628f7b9f98fa3362","id":"s10.normalize.dev.015","path":"research/slice-10/source-lineage/normalize/dev-calibration/s10.normalize.dev.015.json"},"rawAsset":{"byteLength":980,"decodedPixelSha256":"58559519a22e146e7f007da7f13f909d05e2ed50caa72bf251a3f48218bedfac","fileSha256":"d8a6c2c25944685963ec54cfddc1e9f68230d0dd05c07fbefae6ce51d3d7a8eb","mime":"image/png","path":"assets/open/normalize-dev/raw.s05.normalize.dev.015.png","sourceDeclarationDecodedPixelSha256":"58559519a22e146e7f007da7f13f909d05e2ed50caa72bf251a3f48218bedfac"},"schemaVersion":"source-lineage.slice11.v0","sourceFamilyId":"family.s11.normalize.dev.015"}
