{"captureSessionId":"session.s11.normalize.defect.005","categoryId":"injected-defect-control-alpha-holes-source-png","contentHash":"cfa3b03ca1ae6d727c2a778ed30d87000cbf2f78f1b9edb22360d77d7b605aeb","copiedImageBytes":false,"disposition":"applicable","evidenceBoundary":{"c1":0,"e1":0,"formalEvidence":false,"g1":0,"o1":0,"productSupport":false,"r1Pipeline":0,"r1ProductRelease":0,"r1ProductValidation":0,"releaseAllowlist":"none","releaseApproved":0,"releaseRegistered":0,"u1":0,"v1":0},"expectedStableErrorCode":null,"frozenAt":"2026-08-15T23:01:50.529Z","id":"s11.normalize.defect.005","independenceClaim":false,"operation":"normalize","partition":"defect/calibration","priorSlice10GoldIdentityRef":{"byteLength":2207,"contentHash":"8215a5f7fdc722adc35cc6af5700a778c4e4fed9e5443b47f55ca1f8efb7ce51","fileSha256":"0e34764da35e1d80134f827489e019106ef039124da6ce16abadeed94c0eea30","id":"gold-identity.s10.normalize.defect.005","path":"research/slice-10/gold-identities/normalize/defect-calibration/gold-identity.s10.normalize.defect.005.json"},"priorSlice10SourceRef":{"byteLength":2215,"contentHash":"03aca68af3b1fe03a261f393c6f797a77c34e928af392007fc5fd8bc45aae398","fileSha256":"17e98fde0bf9aa06d548130f5a6acd52d064617a8fd09c276146985fd849d140","id":"s10.normalize.defect.005","path":"research/slice-10/source-lineage/normalize/defect-calibration/s10.normalize.defect.005.json"},"rawAsset":{"byteLength":637,"decodedPixelSha256":"a2f045fc5b43bc307f5d962a79208e976b4026ffc1d1e506d3ed523a4548e8d8","fileSha256":"72812288f3d74a41ccab2e4727ff890b981ec072358a9b7f725637491c4bfb2c","mime":"image/png","path":"assets/open/normalize-defect/raw.s05.normalize.defect.005.png","sourceDeclarationDecodedPixelSha256":"a2f045fc5b43bc307f5d962a79208e976b4026ffc1d1e506d3ed523a4548e8d8"},"schemaVersion":"source-lineage.slice11.v0","sourceFamilyId":"family.s11.normalize.defect.005"}
