{"captureSessionId":"session.s11.export.defect.013","categoryId":"injected-parent-identity-file-or-pixel-hash-defect","contentHash":"dd6ef5701255fb9c0ddb99988546db8f3ab9ad6fe1788d3b175dd866ac9a9130","copiedImageBytes":false,"disposition":"rejection","evidenceBoundary":{"c1":0,"e1":0,"formalEvidence":false,"g1":0,"o1":0,"productSupport":false,"r1Pipeline":0,"r1ProductRelease":0,"r1ProductValidation":0,"releaseAllowlist":"none","releaseApproved":0,"releaseRegistered":0,"u1":0,"v1":0},"expectedStableErrorCode":"S11_EXPORT_NORMALIZED_ARTIFACT_INVALID","frozenAt":"2026-08-15T23:01:50.529Z","id":"s11.export.defect.013","independenceClaim":false,"operation":"export","partition":"defect/calibration","priorSlice10GoldIdentityRef":null,"priorSlice10SourceRef":{"byteLength":2335,"contentHash":"5937f8885a7584d7b8d615c3bae19fd6683fd93ddc202b59f8ecb58cd829fbce","fileSha256":"331cd49107e1e1dbb34c92e02a8400097de67dbe16b31154def4ffab99c2b8aa","id":"s10.export.defect.013","path":"research/slice-10/source-lineage/export/defect-calibration/s10.export.defect.013.json"},"rawAsset":{"byteLength":488,"decodedPixelSha256":"93b44ac74f4ceb58f46282b8ebb01805a685278cafdedeb5a8815c6cff11bebd","fileSha256":"93cdde1a38ca340bf4183b8a554e42e827d44ce5f843e31b81f806cb887b5f92","mime":"image/png","path":"assets/open/export-defect/raw.s05.export.defect.013.png","sourceDeclarationDecodedPixelSha256":"93b44ac74f4ceb58f46282b8ebb01805a685278cafdedeb5a8815c6cff11bebd"},"schemaVersion":"source-lineage.slice11.v0","sourceFamilyId":"family.s11.export.defect.013"}
