{"captureSessionId":"session.s11.export.defect.011","categoryId":"injected-parent-identity-file-or-pixel-hash-defect","contentHash":"cbbd6f0ea66059bf2d9bf67ce41d5bd3a0935b39d996aec75f5ca98b47f583a6","copiedImageBytes":false,"disposition":"rejection","evidenceBoundary":{"c1":0,"e1":0,"formalEvidence":false,"g1":0,"o1":0,"productSupport":false,"r1Pipeline":0,"r1ProductRelease":0,"r1ProductValidation":0,"releaseAllowlist":"none","releaseApproved":0,"releaseRegistered":0,"u1":0,"v1":0},"expectedStableErrorCode":"S11_EXPORT_NORMALIZED_ARTIFACT_INVALID","frozenAt":"2026-08-15T23:01:50.529Z","id":"s11.export.defect.011","independenceClaim":false,"operation":"export","partition":"defect/calibration","priorSlice10GoldIdentityRef":null,"priorSlice10SourceRef":{"byteLength":2335,"contentHash":"e6c7d69da9cae141c76af37927a0cc96173ee7ed2a70ab8dd942cc83ac086840","fileSha256":"bd8cf7d8e482b9d6c46c90a84679659e42245062cef4779561eaba75ce2d7a92","id":"s10.export.defect.011","path":"research/slice-10/source-lineage/export/defect-calibration/s10.export.defect.011.json"},"rawAsset":{"byteLength":714,"decodedPixelSha256":"cf2dfb3cf0ed303dae37219b82bce162ec580d27d2bae661f17aad62d9c9c35e","fileSha256":"dd24c4c523be96d410ed07f61801027aad9a4ad689e31aa720092f771ce6d238","mime":"image/png","path":"assets/open/export-defect/raw.s05.export.defect.011.png","sourceDeclarationDecodedPixelSha256":"cf2dfb3cf0ed303dae37219b82bce162ec580d27d2bae661f17aad62d9c9c35e"},"schemaVersion":"source-lineage.slice11.v0","sourceFamilyId":"family.s11.export.defect.011"}
