{"captureSessionId":"session.s11.export.dev.023","categoryId":"parent-identity-file-or-pixel-hash-invalid","contentHash":"6b88f521a165c39154ac80b44c634e23e30f5deb2463aa3983c7ebfe392b9e70","copiedImageBytes":false,"disposition":"rejection","evidenceBoundary":{"c1":0,"e1":0,"formalEvidence":false,"g1":0,"o1":0,"productSupport":false,"r1Pipeline":0,"r1ProductRelease":0,"r1ProductValidation":0,"releaseAllowlist":"none","releaseApproved":0,"releaseRegistered":0,"u1":0,"v1":0},"expectedStableErrorCode":"S11_EXPORT_NORMALIZED_ARTIFACT_INVALID","frozenAt":"2026-08-15T23:01:50.529Z","id":"s11.export.dev.023","independenceClaim":false,"operation":"export","partition":"dev/calibration","priorSlice10GoldIdentityRef":null,"priorSlice10SourceRef":{"byteLength":2285,"contentHash":"798b9ab13345ed86cb74588e8e3e1599270ad5da0e992e633b71f52270279d47","fileSha256":"1b2ef9969bdf3e6dbb5dae76e583a54edcee801e7b37e481bbe78c413bf88b78","id":"s10.export.dev.023","path":"research/slice-10/source-lineage/export/dev-calibration/s10.export.dev.023.json"},"rawAsset":{"byteLength":792,"decodedPixelSha256":"ad94c4218a318f2b57d375618aada242350cd20629b09ff7423d2f7eea7ae7bc","fileSha256":"b603b05e9d62f3d890dda9407005dd19a24008bc0a10bacd66917e36e87e4c97","mime":"image/png","path":"assets/open/export-dev/raw.s05.export.dev.023.png","sourceDeclarationDecodedPixelSha256":"ad94c4218a318f2b57d375618aada242350cd20629b09ff7423d2f7eea7ae7bc"},"schemaVersion":"source-lineage.slice11.v0","sourceFamilyId":"family.s11.export.dev.023"}
