{"captureSessionId":"session.s11.export.defect.008","categoryId":"injected-normalized-artifact-shape-or-contract-defect","contentHash":"d8ee8679813af2f2b331bc0aef685907c32563798275e08db6149390b4e15b67","copiedImageBytes":false,"disposition":"rejection","evidenceBoundary":{"c1":0,"e1":0,"formalEvidence":false,"g1":0,"o1":0,"productSupport":false,"r1Pipeline":0,"r1ProductRelease":0,"r1ProductValidation":0,"releaseAllowlist":"none","releaseApproved":0,"releaseRegistered":0,"u1":0,"v1":0},"expectedStableErrorCode":"S11_EXPORT_NORMALIZED_ARTIFACT_INVALID","frozenAt":"2026-08-15T23:01:50.529Z","id":"s11.export.defect.008","independenceClaim":false,"operation":"export","partition":"defect/calibration","priorSlice10GoldIdentityRef":null,"priorSlice10SourceRef":{"byteLength":2341,"contentHash":"437dfa3fdbb0dd81e186fa38fa3e0d58d71ebd3e70891412bd11e277221125b5","fileSha256":"f2863510659bb8bbb47d54a83e780200cc931ea06340b97548fd442db06ce719","id":"s10.export.defect.008","path":"research/slice-10/source-lineage/export/defect-calibration/s10.export.defect.008.json"},"rawAsset":{"byteLength":1240,"decodedPixelSha256":"54e5e1cf44d194f7a3eff2d3b2cc4bf3d12c7bc527c6c3256b63b1fca30411ea","fileSha256":"35f20c8adac63b0878c782d8954eab53087566905281fc5f7e778eafb4221fbc","mime":"image/png","path":"assets/open/export-defect/raw.s05.export.defect.008.png","sourceDeclarationDecodedPixelSha256":"54e5e1cf44d194f7a3eff2d3b2cc4bf3d12c7bc527c6c3256b63b1fca30411ea"},"schemaVersion":"source-lineage.slice11.v0","sourceFamilyId":"family.s11.export.defect.008"}
