{"captureSessionId":"session.s11.export.dev.016","categoryId":"valid-alpha-holes-normalized-artifact","contentHash":"7832308774877e1e7e19d5b0ae24839644c18f1fb7eb91dc22a2e5a721511a24","copiedImageBytes":false,"disposition":"applicable","evidenceBoundary":{"c1":0,"e1":0,"formalEvidence":false,"g1":0,"o1":0,"productSupport":false,"r1Pipeline":0,"r1ProductRelease":0,"r1ProductValidation":0,"releaseAllowlist":"none","releaseApproved":0,"releaseRegistered":0,"u1":0,"v1":0},"expectedStableErrorCode":null,"frozenAt":"2026-08-15T23:01:50.529Z","id":"s11.export.dev.016","independenceClaim":false,"operation":"export","partition":"dev/calibration","priorSlice10GoldIdentityRef":{"byteLength":2540,"contentHash":"342d5b802f56334313ee848d5c39a5954677aa99e61bd7ff830726822863e5ef","fileSha256":"6cef34038ff35084a39a3bf684e59c2303049a4c85c5155afb5a1b34e0f90026","id":"gold-identity.s10.export.dev.016","path":"research/slice-10/gold-identities/export/dev-calibration/gold-identity.s10.export.dev.016.json"},"priorSlice10SourceRef":{"byteLength":2451,"contentHash":"b0f91d6e489c0aaaa3d045d3fa7521f7112174ffd92da62a7fe8c103d6a7a846","fileSha256":"192cfc137a7ea2b4a27dd8a8c676b936b93a4b498f3945c3697c62ad7800914b","id":"s10.export.dev.016","path":"research/slice-10/source-lineage/export/dev-calibration/s10.export.dev.016.json"},"rawAsset":{"byteLength":1609,"decodedPixelSha256":"00c96d99710caae26da61fe297d2765fe267da4549bacebd5d001af1b6f8ae08","fileSha256":"b431e3fc9d99e57cbe84cbf3485dd81dfeb8e2a244e5b5ac2becaec8c6874b53","mime":"image/png","path":"assets/open/export-dev/raw.s05.export.dev.016.png","sourceDeclarationDecodedPixelSha256":"00c96d99710caae26da61fe297d2765fe267da4549bacebd5d001af1b6f8ae08"},"schemaVersion":"source-lineage.slice11.v0","sourceFamilyId":"family.s11.export.dev.016"}
