{"captureSessionId":"session.s11.normalize.defect.014","categoryId":"injected-pixel-layout-color-or-metadata-defect","contentHash":"f695356a7a26feeb8cb615daeb0af64583e5394cbb98c09b88c478c69e59613c","copiedImageBytes":false,"disposition":"rejection","evidenceBoundary":{"c1":0,"e1":0,"formalEvidence":false,"g1":0,"o1":0,"productSupport":false,"r1Pipeline":0,"r1ProductRelease":0,"r1ProductValidation":0,"releaseAllowlist":"none","releaseApproved":0,"releaseRegistered":0,"u1":0,"v1":0},"expectedStableErrorCode":"S11_INPUT_SRGB_REQUIRED","frozenAt":"2026-08-15T23:01:50.529Z","id":"s11.normalize.defect.014","independenceClaim":false,"operation":"normalize","partition":"defect/calibration","priorSlice10GoldIdentityRef":null,"priorSlice10SourceRef":{"byteLength":1951,"contentHash":"02adbd2a37ec692da653fa39a8215b7e6f7bf54db906dcf9831424f83c3614dd","fileSha256":"5c445f50971e9507d48cd83e298f885d788ab7cc52c9a4bb909ca3faa9f07d26","id":"s10.normalize.defect.014","path":"research/slice-10/source-lineage/normalize/defect-calibration/s10.normalize.defect.014.json"},"rawAsset":{"byteLength":429,"decodedPixelSha256":null,"fileSha256":"5570b19c5b7339abf5d69e5b9172b770646a4b53b8e1f983a2405f971373da1a","mime":"image/png","path":"assets/open/normalize-defect/raw.s05.normalize.defect.014.png","sourceDeclarationDecodedPixelSha256":"a44e1734988837cfe97732b7164e87fb99e901487cbba0a0fb70743be6e8b95b"},"schemaVersion":"source-lineage.slice11.v0","sourceFamilyId":"family.s11.normalize.defect.014"}
