{"captureSessionId":"session.s11.export.defect.002","categoryId":"injected-defect-control-opaque-normalized-artifact","contentHash":"c446ebaa5994a59590143b79c2fee4aba68f1569f460bf90d4707553c2f1e590","copiedImageBytes":false,"disposition":"applicable","evidenceBoundary":{"c1":0,"e1":0,"formalEvidence":false,"g1":0,"o1":0,"productSupport":false,"r1Pipeline":0,"r1ProductRelease":0,"r1ProductValidation":0,"releaseAllowlist":"none","releaseApproved":0,"releaseRegistered":0,"u1":0,"v1":0},"expectedStableErrorCode":null,"frozenAt":"2026-08-15T23:01:50.529Z","id":"s11.export.defect.002","independenceClaim":false,"operation":"export","partition":"defect/calibration","priorSlice10GoldIdentityRef":{"byteLength":2583,"contentHash":"afaf53db4fb139eccd20122646bb0bf01873f34b6befec245d4913c4c9c3f63d","fileSha256":"65dac49707efec8f67c138ec859210f11127c71ba141431aaf07910f2d428c8f","id":"gold-identity.s10.export.defect.002","path":"research/slice-10/gold-identities/export/defect-calibration/gold-identity.s10.export.defect.002.json"},"priorSlice10SourceRef":{"byteLength":2514,"contentHash":"a71f3c62ba8ba6c143e124decc6efbc6d35c93de7699d3b57ad2553160504463","fileSha256":"a482e4e968ffc66e70a1f634a7ee380ce30358eb0ced8ce42d6d783661b52ec7","id":"s10.export.defect.002","path":"research/slice-10/source-lineage/export/defect-calibration/s10.export.defect.002.json"},"rawAsset":{"byteLength":714,"decodedPixelSha256":"80c306afb6feec5d27c4469c46dda7cdddba5ef103db99178de7da19046aeb9c","fileSha256":"9b610f04ae574cb4eec008b2aff6891e326266ac2cbe8a27c300402d66467456","mime":"image/png","path":"assets/open/export-defect/raw.s05.export.defect.002.png","sourceDeclarationDecodedPixelSha256":"80c306afb6feec5d27c4469c46dda7cdddba5ef103db99178de7da19046aeb9c"},"schemaVersion":"source-lineage.slice11.v0","sourceFamilyId":"family.s11.export.defect.002"}
