{"captureSessionId":"session.s11.normalize.defect.015","categoryId":"injected-resource-limit-or-unsupported-format-defect","contentHash":"d7a266a2ae550316d495129967fdc85020439b699e44f7266bc1e41a0ca97b6f","copiedImageBytes":false,"disposition":"rejection","evidenceBoundary":{"c1":0,"e1":0,"formalEvidence":false,"g1":0,"o1":0,"productSupport":false,"r1Pipeline":0,"r1ProductRelease":0,"r1ProductValidation":0,"releaseAllowlist":"none","releaseApproved":0,"releaseRegistered":0,"u1":0,"v1":0},"expectedStableErrorCode":"S11_NORMALIZE_SOURCE_DECLARATION_INVALID","frozenAt":"2026-08-15T23:01:50.529Z","id":"s11.normalize.defect.015","independenceClaim":false,"operation":"normalize","partition":"defect/calibration","priorSlice10GoldIdentityRef":null,"priorSlice10SourceRef":{"byteLength":1972,"contentHash":"b97249f52cf48ec765348d1d8134c5a05586a57ee2bbb133304c4ee10961cf78","fileSha256":"78d44610823283155a1f3e48c8c0ad481f543f663f1015f3a432189cafb0d1bd","id":"s10.normalize.defect.015","path":"research/slice-10/source-lineage/normalize/defect-calibration/s10.normalize.defect.015.json"},"rawAsset":{"byteLength":38,"decodedPixelSha256":null,"fileSha256":"65c7aa843a6ed88546433eb5ecc720b2cca33cdc1ed78ea405f903fbdfa9cfc2","mime":"image/jpeg","path":"assets/open/normalize-defect/raw.s05.normalize.defect.015.jpg","sourceDeclarationDecodedPixelSha256":"c4247b4909c4cda2e5a5cb2792dc4fc90be1452bc41bb020bde6472a6b34d249"},"schemaVersion":"source-lineage.slice11.v0","sourceFamilyId":"family.s11.normalize.defect.015"}
