{"captureSessionId":"session.s11.export.defect.005","categoryId":"injected-defect-control-alpha-holes-normalized-artifact","contentHash":"825202f69b8ee31eb55e35a0adc33bb2884f67a638656d6462666a28e14d079d","copiedImageBytes":false,"disposition":"applicable","evidenceBoundary":{"c1":0,"e1":0,"formalEvidence":false,"g1":0,"o1":0,"productSupport":false,"r1Pipeline":0,"r1ProductRelease":0,"r1ProductValidation":0,"releaseAllowlist":"none","releaseApproved":0,"releaseRegistered":0,"u1":0,"v1":0},"expectedStableErrorCode":null,"frozenAt":"2026-08-15T23:01:50.529Z","id":"s11.export.defect.005","independenceClaim":false,"operation":"export","partition":"defect/calibration","priorSlice10GoldIdentityRef":{"byteLength":2582,"contentHash":"1dc48ddd6404728f4097b67a13f9f0be19015066f4e50a8a803dedd12309068c","fileSha256":"78d6cc06a2d5be2c404b8c00ed6473a35d69148b344e210f4859dd952f5887f2","id":"gold-identity.s10.export.defect.005","path":"research/slice-10/gold-identities/export/defect-calibration/gold-identity.s10.export.defect.005.json"},"priorSlice10SourceRef":{"byteLength":2520,"contentHash":"4b124f5435c18e4633e2df3d155e1558018b2b9e2e0b5e747203e1c37d5a1847","fileSha256":"c626be208f7e0da272a2cd516b0399503722f11906f22bfc9f747d8704f5e229","id":"s10.export.defect.005","path":"research/slice-10/source-lineage/export/defect-calibration/s10.export.defect.005.json"},"rawAsset":{"byteLength":1404,"decodedPixelSha256":"90ab22e144ae71d9aebf7754ab48740f29a0f6af8a3902d8e66c96edb908f526","fileSha256":"601b11813e11ad89d78c61a0cc1bdb9f4c42230b6bd2555978ef9400e74591d9","mime":"image/png","path":"assets/open/export-defect/raw.s05.export.defect.005.png","sourceDeclarationDecodedPixelSha256":"90ab22e144ae71d9aebf7754ab48740f29a0f6af8a3902d8e66c96edb908f526"},"schemaVersion":"source-lineage.slice11.v0","sourceFamilyId":"family.s11.export.defect.005"}
