{"captureSessionId":"session.s11.export.dev.017","categoryId":"valid-alpha-holes-normalized-artifact","contentHash":"191079fc9be7537b592cef1357ea51e6bb06eb5ba40bf6901af161ff107f0308","copiedImageBytes":false,"disposition":"applicable","evidenceBoundary":{"c1":0,"e1":0,"formalEvidence":false,"g1":0,"o1":0,"productSupport":false,"r1Pipeline":0,"r1ProductRelease":0,"r1ProductValidation":0,"releaseAllowlist":"none","releaseApproved":0,"releaseRegistered":0,"u1":0,"v1":0},"expectedStableErrorCode":null,"frozenAt":"2026-08-15T23:01:50.529Z","id":"s11.export.dev.017","independenceClaim":false,"operation":"export","partition":"dev/calibration","priorSlice10GoldIdentityRef":{"byteLength":2539,"contentHash":"4a7456f9d67de3d58f67645538e8e5d0f10d7525ff68d0acfa31af577fb6bde0","fileSha256":"2fdc8330d24ee009d0aa6dabdfa6f0df55d08ec94c621920614e9028216947f6","id":"gold-identity.s10.export.dev.017","path":"research/slice-10/gold-identities/export/dev-calibration/gold-identity.s10.export.dev.017.json"},"priorSlice10SourceRef":{"byteLength":2450,"contentHash":"0ae789379ba41534bcdb705260c19d81e65da1052aa8a8f9be7e4b8e28c9136a","fileSha256":"0e0fbbec1b343af598e60b592325e5397b5eb55421bb3d69106f2c6ccd31c45e","id":"s10.export.dev.017","path":"research/slice-10/source-lineage/export/dev-calibration/s10.export.dev.017.json"},"rawAsset":{"byteLength":441,"decodedPixelSha256":"0aaf39403b95a04cb7a77e2202e412091f70167338db7e33a1a4660fdeee3f2e","fileSha256":"ae654bebc9a9a6096678f3566bccb65431a4fd2df397681a77002a4613702fc7","mime":"image/png","path":"assets/open/export-dev/raw.s05.export.dev.017.png","sourceDeclarationDecodedPixelSha256":"0aaf39403b95a04cb7a77e2202e412091f70167338db7e33a1a4660fdeee3f2e"},"schemaVersion":"source-lineage.slice11.v0","sourceFamilyId":"family.s11.export.dev.017"}
