{"captureSessionId":"session.s11.normalize.dev.019","categoryId":"container-signature-or-crc-invalid","contentHash":"014b35308149bad53467df60441a45f6bc223ba75b70953ff0598bea54869978","copiedImageBytes":false,"disposition":"rejection","evidenceBoundary":{"c1":0,"e1":0,"formalEvidence":false,"g1":0,"o1":0,"productSupport":false,"r1Pipeline":0,"r1ProductRelease":0,"r1ProductValidation":0,"releaseAllowlist":"none","releaseApproved":0,"releaseRegistered":0,"u1":0,"v1":0},"expectedStableErrorCode":"S11_INPUT_CRC_MISMATCH","frozenAt":"2026-08-15T23:01:50.529Z","id":"s11.normalize.dev.019","independenceClaim":false,"operation":"normalize","partition":"dev/calibration","priorSlice10GoldIdentityRef":null,"priorSlice10SourceRef":{"byteLength":1904,"contentHash":"ad286119f086dd87bdc14c5f5e06f2c2df528741764e79349777bf5c26db008d","fileSha256":"3165b6f9c0e72fdf56643faf932f972abb0e26c5bd8f5902fdcb246604672ab7","id":"s10.normalize.dev.019","path":"research/slice-10/source-lineage/normalize/dev-calibration/s10.normalize.dev.019.json"},"rawAsset":{"byteLength":622,"decodedPixelSha256":null,"fileSha256":"542c939e0ae570d6d6b7a46d8881cf095787d59fb76dd0a591f978e79a6e7778","mime":"image/png","path":"assets/open/normalize-dev/raw.s05.normalize.dev.019.png","sourceDeclarationDecodedPixelSha256":"bcd21ddbfa4cfb2dc16bf7e4f1af7e2dc20fefbbf81130cc69cf0dba3c8f3809"},"schemaVersion":"source-lineage.slice11.v0","sourceFamilyId":"family.s11.normalize.dev.019"}
