{"captureSessionId":"session.s11.normalize.dev.011","categoryId":"canonical-partial-alpha-source-png","contentHash":"99f9d4429cef4ffd8b516233c3cc876135973b6b40c76faed44715b56fe98d47","copiedImageBytes":false,"disposition":"applicable","evidenceBoundary":{"c1":0,"e1":0,"formalEvidence":false,"g1":0,"o1":0,"productSupport":false,"r1Pipeline":0,"r1ProductRelease":0,"r1ProductValidation":0,"releaseAllowlist":"none","releaseApproved":0,"releaseRegistered":0,"u1":0,"v1":0},"expectedStableErrorCode":null,"frozenAt":"2026-08-15T23:01:50.529Z","id":"s11.normalize.dev.011","independenceClaim":false,"operation":"normalize","partition":"dev/calibration","priorSlice10GoldIdentityRef":{"byteLength":2173,"contentHash":"fff84e8d2a950b97504b883e33b08687faa917d3ab1f28427b96cec2b3e51928","fileSha256":"f3bc83d10758e9db1a518e1a979cf94b9ffaaa652615564d82b3cb53fcd7aed0","id":"gold-identity.s10.normalize.dev.011","path":"research/slice-10/gold-identities/normalize/dev-calibration/gold-identity.s10.normalize.dev.011.json"},"priorSlice10SourceRef":{"byteLength":2161,"contentHash":"4cece7897fc6437389c7c4fec5c5044165e7a607b99accaf4a0a34317feb1a09","fileSha256":"3d425d7d6fad67077308ab77d68eb3f426fec7e587f287dbc4658863fd4ee661","id":"s10.normalize.dev.011","path":"research/slice-10/source-lineage/normalize/dev-calibration/s10.normalize.dev.011.json"},"rawAsset":{"byteLength":665,"decodedPixelSha256":"29600339309ada55b343e700c2b5b7e68736ddd922c65a649473a72c50db78ec","fileSha256":"6597d0cd4f655bd06ef7a29de030312280aeef2bfbb41d0cdedd1aea74599180","mime":"image/png","path":"assets/open/normalize-dev/raw.s05.normalize.dev.011.png","sourceDeclarationDecodedPixelSha256":"29600339309ada55b343e700c2b5b7e68736ddd922c65a649473a72c50db78ec"},"schemaVersion":"source-lineage.slice11.v0","sourceFamilyId":"family.s11.normalize.dev.011"}
