{"captureSessionId":"session.s11.export.dev.009","categoryId":"valid-partial-alpha-normalized-artifact","contentHash":"85175422f92e4739f095eca5ad3a47542630fcd33d4b666809614eba1e1df8ae","copiedImageBytes":false,"disposition":"applicable","evidenceBoundary":{"c1":0,"e1":0,"formalEvidence":false,"g1":0,"o1":0,"productSupport":false,"r1Pipeline":0,"r1ProductRelease":0,"r1ProductValidation":0,"releaseAllowlist":"none","releaseApproved":0,"releaseRegistered":0,"u1":0,"v1":0},"expectedStableErrorCode":null,"frozenAt":"2026-08-15T23:01:50.529Z","id":"s11.export.dev.009","independenceClaim":false,"operation":"export","partition":"dev/calibration","priorSlice10GoldIdentityRef":{"byteLength":2540,"contentHash":"a4d16ed99cbc27fbde378b4423dabb653bc864d79d4b379294716a0ac8e2221c","fileSha256":"7128c085b3c77256f3b538493e397c388f103eef1efe1bb252819659b3873223","id":"gold-identity.s10.export.dev.009","path":"research/slice-10/gold-identities/export/dev-calibration/gold-identity.s10.export.dev.009.json"},"priorSlice10SourceRef":{"byteLength":2452,"contentHash":"780f780b904471d142678485ba46cdd50d8c035da0958d693132d3d1b4af913d","fileSha256":"7ba28f8beda7230c4bc71f859def431045c28a1489bcb97227783f4dfb3f2231","id":"s10.export.dev.009","path":"research/slice-10/source-lineage/export/dev-calibration/s10.export.dev.009.json"},"rawAsset":{"byteLength":982,"decodedPixelSha256":"f75931d75da21a5e7533b6358c64094628f77764baadcb2e8869a3abc272916b","fileSha256":"a8b3388c86408f1570c03620c2d75e74cb1debe093745fe4bde0e5b4bb826255","mime":"image/png","path":"assets/open/export-dev/raw.s05.export.dev.009.png","sourceDeclarationDecodedPixelSha256":"f75931d75da21a5e7533b6358c64094628f77764baadcb2e8869a3abc272916b"},"schemaVersion":"source-lineage.slice11.v0","sourceFamilyId":"family.s11.export.dev.009"}
