{"captureSessionId":"session.s11.normalize.dev.005","categoryId":"canonical-opaque-source-png","contentHash":"93619d0c9e33363837045dfd7ef4e216856502b18dc78dac527028882a1cfaf5","copiedImageBytes":false,"disposition":"applicable","evidenceBoundary":{"c1":0,"e1":0,"formalEvidence":false,"g1":0,"o1":0,"productSupport":false,"r1Pipeline":0,"r1ProductRelease":0,"r1ProductValidation":0,"releaseAllowlist":"none","releaseApproved":0,"releaseRegistered":0,"u1":0,"v1":0},"expectedStableErrorCode":null,"frozenAt":"2026-08-15T23:01:50.529Z","id":"s11.normalize.dev.005","independenceClaim":false,"operation":"normalize","partition":"dev/calibration","priorSlice10GoldIdentityRef":{"byteLength":2175,"contentHash":"b2807d13bf1bd908a5963d09056f5b8875cbac1974436fa8896a6f09ffc3faf4","fileSha256":"66c7c12401f6f5f7da45ab5dade592c134b632c1d25a530e94b09ee37530e760","id":"gold-identity.s10.normalize.dev.005","path":"research/slice-10/gold-identities/normalize/dev-calibration/gold-identity.s10.normalize.dev.005.json"},"priorSlice10SourceRef":{"byteLength":2155,"contentHash":"be0e69556fc7d4d1aeeb21f40f7cedd990ca9e7d22693de21e86c68eb5816c67","fileSha256":"20126cd5092e1df8862fc1a2373352f489db516063f2b36cbb17cfe1ebb4b2ca","id":"s10.normalize.dev.005","path":"research/slice-10/source-lineage/normalize/dev-calibration/s10.normalize.dev.005.json"},"rawAsset":{"byteLength":1372,"decodedPixelSha256":"8c5c4dcb314ea3423c7e4f89e6a9dd94a07cbb42e59548e2ccb58851bb595db9","fileSha256":"12e80ba4cccf83d7e01760104b28f62df6e2ded181e126a751d8e175141b4b1f","mime":"image/png","path":"assets/open/normalize-dev/raw.s05.normalize.dev.005.png","sourceDeclarationDecodedPixelSha256":"8c5c4dcb314ea3423c7e4f89e6a9dd94a07cbb42e59548e2ccb58851bb595db9"},"schemaVersion":"source-lineage.slice11.v0","sourceFamilyId":"family.s11.normalize.dev.005"}
